### ISSUE TITLE
repl not repling

### ISSUE THREAD

**Issue by cooleynal** [nobody-famous/alive#40]
have repl-localhost-4005.alive-repl functioning in visual studio code. However regardless if i type (require 'asdf) or anything, the REPL window is unresponsive and becomes a generic text editor, any pointers?

started on lisp a few days ago.

**Comment by cooleynal** [comment]
to add when I open the REPL window I have this

"
CL-USER> 
CL-USER> 
CL-USER> 
CL-USER> 
"

Thanks.

**Comment by smashedtoatoms** [comment]
So if you do something like `(+ 2 2)` in code, and then eval it with ctrl+enter or whatever you have it set to, what does it do?

**Comment by cooleynal** [comment]
Thanks for the fast reply. 

Please hang tight restarting the program to see if it makes changes.

**Comment by cooleynal** [comment]
no change :/
just acts as a new line and the CL-USER> prompt isnt repeated.

**Comment by nobody-famous** [comment]
The repl window is implemented as a text document so that you can edit stuff normally in it. To get it to eval something, you need to run the Send To Repl command, which defaults to alt+shift+enter if you haven't changed it.

**Comment by cooleynal** [comment]
i love you.  Seriously!  got back 

(require 'asdf)

=> nil
CL-USER>

**Comment by cooleynal** [comment]
now to spam you some more if you dont mind, now i need to get asdf working?

**Comment by nobody-famous** [comment]
Ok, that should have loaded the library. Then you need to load your .asd file. If you have it open, doing Alt+Shift+L inside it should load it. Then in the repl (asdf:load-system "whatever you named it") should work.

**Comment by cooleynal** [comment]
I am still here, I am very new in this environment. Will take me a minute to understand what that means then to execute. 

I ask for your patience. Thanks.

**Comment by nobody-famous** [comment]
Oh, right. I need to update that gif. It doesn't print that message anymore. Weird, technical reasons. :-)

**Comment by cooleynal** [comment]
ah i dont feel so dorky. 

So. I don't think I ever manually loaded an asd f file.  In my earlier attempts to get this working, I installed quicklisp but its not used, however I found a huge asdf.lisp file in it. 

I do remember when I installed SBCL and ran through the prompts and I saw something saying asdf but I did not know what it was.

So can i move that asdf file to where the server is located ?

**Comment by nobody-famous** [comment]
No worries, it takes some getting used to.

The require command loads the ASDF library, which lets you run the various commands.

The main one is asdf:load-system, which will load a system you defined with a defsystem statement. It's usually put in a file with the same name as the system you define. So, foo.asd will have a (defsystem "foo" ...) inside it.

You need to evaluate all the stuff inside that file so that ASDF can load it. The easiest way to do that is to do the Load File command, Alt+Shift+L.

**Comment by nobody-famous** [comment]
SBCL includes ASDF so you don't have to install it separately, which is what the asdf.lisp file is.

**Comment by cooleynal** [comment]
huh okay, I dont see it where I have installed it in sbcl, which is one folder outside of where my visual studio code project is

**Comment by cooleynal** [comment]
Alt shift L on the repl doesnt do anything, but on my little program causes a crash

**Comment by nobody-famous** [comment]
Hmm... maybe that version is from something else. In my SBCL install it has asdf.fasl, which is a compiled version.

**Comment by cooleynal** [comment]
sorry. you are correct. first file in the contrib folder

**Comment by nobody-famous** [comment]
Oh, right. alt shift L in the asdf file editor. doing it in the repl will try to load the repl contents, which probably won't end well. Actually, that shouldn't be enabled. I'll have to fix that.

**Comment by cooleynal** [comment]
afds.fasl

**Comment by cooleynal** [comment]
The fact you know this stuff is amazing,

**Comment by nobody-famous** [comment]
Wait, I think I misunderstood you. What crashed?

**Comment by nobody-famous** [comment]
It's amazing how much you learn writing an extension like this. :-) I didn't know this stuff nearly as well until I had to try to handle all the edge cases that can come up.

**Comment by cooleynal** [comment]
Alt shift L when i have the program called tt1.lisp highlighted crashes. 

When I have repl window highlighted (asdf:load-system: tt1) followed by Alt Shift Enter crashes 

That being said I have an error in my code.  I am throwing something else on it now and trying.

**Comment by cooleynal** [comment]
I am documenting a notepad cheatsheet as were going through this, so thats where my delays might stem from to.

**Comment by nobody-famous** [comment]
When you say it crashed, does the debugger come up? Or the REPL gets hosed?

**Comment by cooleynal** [comment]
debugger in both cases. sorry. Overall this is very well behaved.

**Comment by smashedtoatoms** [comment]
I don't know if it will help you or not, but I started using a tool called [clpm](https://clpm.dev) that works like package tools in other languages.  If you install it, it can be configured to interact with asdf in a way that lets the debugger intercept the errors caused by libraries missing, and automatically install them for you via the debugger.  It won't get you around having to learn asdf, but it will let you tinker a little more easily.  I have a gif [here](https://smashedtoatoms/replin.gif) if you want to see what I mean.

**Comment by nobody-famous** [comment]
Ok, cool. Just a heads up, SBCL on windows is flaky. Their info banner mentions it. The main weirdness I've found with it is doing command completion with anything starting with p causes the debugger to come up. I have no idea why that happens. It also takes swank several minutes to exit.

**Comment by cooleynal** [comment]
okay thanks. Ill wrestle this a bit more.

I noticed that in the docs on sbcl as well, was hoping to have a modern compiler.

How do i change my compiling hotkeys? i didnt see it in the options

**Comment by nobody-famous** [comment]
I need to look into clpm. It sounds like there's some good stuff going on there.

**Comment by smashedtoatoms** [comment]
Also, @cooleynal, if you are on windows, you may find it easier to do all of this in wsl.  Code can hook to it from windows and it works great.  Worst case, you can do your dev and repling in wsl, and then if you need to build a windows binary, suffer through it then.

**Comment by nobody-famous** [comment]
To change the hotkeys, go to File->Preferences->Keyboard Shortcuts and you can set them to whatever in there. It'll also let you know what they conflict with. I prefixed all the commands with Alive, so you should be able to search for that.

**Comment by cooleynal** [comment]
thanks. Ill look at that in a bit.

So I fixed the program called tt1.lisp, its a simple : (write-line "Hello World").

I saved it. 

(require 'asdf) alt shift enter. and i get back ...

(require 'asdf)

=> NIL
CL-USER> 

So where do I go from here?

**Comment by cooleynal** [comment]
OH shoot, i see demo.asd and math.lisp. 

I dont know what an .asd is.

**Comment by cooleynal** [comment]
taking your work, would 

(in-package :asdf-user)
(defsystem "exp"
    :components ((: file "package")
                 (:file "tt1")))

work as an asd file?

**Comment by nobody-famous** [comment]
Yeah, it looks like that should work. After you load that file, do (asdf:load-system "exp") in the reply and it should load it.

**Comment by cooleynal** [comment]
hmm nothing on alt shift L, and alt shift enter gives errors

**Comment by cooleynal** [comment]
Error while trying to load definition for system exp from pathname C:/Users/tr/Desktop/LISP VSC/COMP-456/exp.asd:    READ error during LOAD:      illegal terminating character after a colon: #\\        Line: 3, Column: 19, File-Position: 61        Stream: #
   [Condition of type ASDF/FIND-SYSTEM:LOAD-SYSTEM-DEFINITION-ERROR

**Comment by nobody-famous** [comment]
Hmmm... doing Alt+Shift+L from your exp.asd file should have a couple comments show up in the repl saying it's loading the file.

The error is because you have a space after one of the colons, ": file" instead of ":file". A colon starts a symbol, so a colon by itself is illegal.

**Comment by cooleynal** [comment]
;; Loading c:\Users\tr\Desktop\LISP VSC\COMP-456\exp.asd

;; Done loading c:\Users\tr\Desktop\LISP VSC\COMP-456\exp.asd
CL-USER> 

boom! good eye

Still messing around with it. 

I have clisp running on eclipse with danelion, ive just like the interface of VS code more and hope to have this figured out enough where i can use it for my course.

**Comment by cooleynal** [comment]
when selecting exp.asd i put alt+shift+l
;; Loading c:\Users\tr\Desktop\LISP VSC\COMP-456\exp.asd

;; Done loading c:\Users\tr\Desktop\LISP VSC\COMP-456\exp.asd

    CL-USER> (require 'asdf) and alt shift enter
(require 'asdf)

=> NIL

(asdf:load-system: tt1) and alt+shift+enter
throws an error. too many colons in \"load-system\"   Line: 1, Column: 17, File-Position: 17   Stream: #
   [Condition of type SB-INT:SIMPLE-READER-ERROR]

i cant win haha

**Comment by cooleynal** [comment]
I think i bit off more than i can chew in trying your product, I hardly know the language. Thanks for your support but this is a lot to wrestle this early in my experience. I will defiantly be checking back regularly. 

Its a shame that lisp is this hard to get started (unless you use portacle) its such a cool language and integrating compability with cool IDEs would defiantly help get it some more clout.

**Comment by nobody-famous** [comment]
It's the colon problem again. Symbols are like constant strings. Sort of. So, :tt1 is roughly equivalent to "tt1". Either one should work here. (asdf:load-system :tt1) and (asdf:load-system "tt1") should be equivalent. They're interchangeable whenever a macro takes a "string designator". Load-system is one, in-package is another. (in-package :cl-user) and (in-package "cl-user") are equivalent.

Because you had the colon at the end of load-system, it complained that there was already a colon in that token. A symbol can be prefixed with the package it's in, which is what asdf:load-package is doing. load-package is a symbol in the asdf package.

**Comment by nobody-famous** [comment]
I definitely feel your pain. Wait til you try to wrestle with the loop macro. :-)

It's a different language that hasn't been updated since the 90s, so it doesn't follow the norms of other current languages. For example, it doesn't throw and catch exceptions. It signals and handles conditions. Really the same thing, but it was created before try/catch was popular so doesn't use that terminology.

Stick with it. There's some interesting things with it that are worth learning about.

**Comment by cooleynal** [comment]
I cant win haha. 
(asdf:load-system :tt1) + alt shift L

Component :TT1 not found
   [Condition of type ASDF/FIND-COMPONENT:MISSING-COMPONENT]

Its okay, I give up and I need to direct my study to the language instead of wrestle it.

Yeah its a remarkable language that I have yet to appreciate. for my course I can do prolog or lisp, I am sticking with lisp since its older, I expected some hickups. We got no information on how to run lisp programs, just told two lines :"clisp and quicklisp" and here is a book. Joys of online learning. based on course descriptions, some other universities run this course in java to make things easier on the students. 

I am always getting my hotkeys mixed up and glitching up portacle and thats my intent to get into a nice IDE like VScode or eclipse. 

Even lisp integrates pooly in eclipse, with clisp and SBCL, and about four different versions with each, only one of them works on my windows PC. I also manually installed SBCL (the one that works here) and getting IO exceptions. 

Back to 2010 32 bit on single threads on clisp i guess lol.

I learned a bit here, didnt know we could package, and i guess the asd file is a module to C++, or java is package

Any chance lisp proper programs can run on clojure? if so, I could just rename my files to .lisp and hand them in that way.

**Comment by nobody-famous** [comment]
Yeah, you might be better skipping asdf for now. The error means your defsystem call didn't take, for some reason.

All asdf is really doing is letting you organize large projects and loads the files for you. You can load the files manually and if you're only using a single file then asdf is overkill, anyway.

The analogy for asdf is
system == application
package == module/namespace

Lisp is different in that the compiler and runtime aren't separate. With other languages you compile text into whatever the runtime takes and then the runtime loads that. With Lisp, the compiler is the runtime. You start the compiler and then give it things to compile.

If you have a file with 2 functions, foo and bar, they don't get compiled together. The first one is compiled and loaded, then the next one. That's why macros can do all their weird things. The compiler has access to everything that's already been compiled.

**Comment by nobody-famous** [comment]
AFAIK, there isn't a way to translate Common Lisp into Clojure, or vice versa. If Clojure is an option, it's a little easier to deal with as a language and Calva is a pretty nice environment.

**Comment by cooleynal** [comment]
Ah. no option there, 100% lisp and or prolog.

np. i think i got a descent environment going.

I am also reading that we want to be able to code our database, and then query parts of it. if we hit a bug, then we want to evaluate only the top level of the program sometimes. So thats a case where we want more interactivity than notepad++ and basic clisp. Is this the case?

Here i can evaluate vile and evaluate file, evaluate selection, and evaluate selected top level. 
Is this basically the functionality of emacs, slime, etc and the requirements of a robust lisp environment?

and github and all the jazz of eclipse.

**Comment by nobody-famous** [comment]
Yeah, I'm making the same calls that Emacs/Slime uses so it's mostly the same. There's some fringe stuff that I haven't done, but most of the useful parts should be comparable.

The db part is one of the useful things with using the repl. You can read the data into a variable, using defvar or defparameter, and then mess with it all you want without having to hit the db over and over again.

**Comment by cooleynal** [comment]
wrestled it a bit more, looks like its working! 

As you said it takes a lot getting use to.

**Comment by smashedtoatoms** [comment]
I don't know if this is helpful, but I created a little tutorial on how to use Alive with SBCL [here](https://smashedtoatoms.com/dev-life/sbcl-with-vscode-via-clpm-2021/). It's not done, but it might help people get started.  I will keep adding to it.

**Comment by cooleynal** [comment]
Very nice. I wont go through it until I have to, however i am saving it under bookmarks as it looks great.

Asking for personal opinions. Is VS Code a good environment to do in lisp? The lisp community sounds very niche relative to the other programming communities and the general consensus is emcs. 

I think a lot of it is people are use to operating in the environment they started with.

This is my cheat sheet to fire things up.

==from term==
ros run
(ql:quickload :slynk)
(slynk:create-server :dont-close t)

==from VCS==
ctrl+shift+p
alive

==in repl==
something
Alt+Shift+Enter
//Ctrl

==in file==
Alt+Shift+L

==in selection==
Alt+Shift+Enter

==open second VSC==
==Click drag tab to new VSC, SPLIT SCREEN!==

I am happy with this setup.

**Comment by smashedtoatoms** [comment]
I think if you're happy with your setup, then stick with it. I'm generally unhappy with my emacs setup and prefer vscode; however I am definitely swimming against the current. I  have recently found vscode to be pretty legit for Common Lisp due to this repo, but it's pretty new and doesn't have a lot of traction yet.

**Comment by cooleynal** [comment]
hmm my swank and sly server closes after about 30 seconds of inactivity. This is the output.
 ;; swank:close-connection: end of file on #<dynamic-extent STRING-INPUT-STREAM (unavailable) from "(:emacs-...">

Any way to keep it open? 
(slynk:create-server :dont-close t)
No change.

**Comment by cooleynal** [comment]
might be doing that when a file isnt loaded... waiting out

**Comment by cooleynal** [comment]
hmm i started today being like im gonna really get to this and my server keeps shutting down, im reviewing your guide now.

**Comment by nobody-famous** [comment]
I'll have to try it with slynk, I've only been using swank. They could be doing something different.

Looking through swank's source, it's supposed to send a ping every so often. I've never seen it do that. Maybe slynk is actually sending it, not getting a response, and shutting it down.

I'll look into it.

The main thing I've seen cause it to shut down the connection is if something malformed gets sent to swank, which would mean the parser is doing something wrong. I wouldn't think it would wait that long, though.

**Comment by smashedtoatoms** [comment]
I haven't tried it with slynk, but sly is incredibly well done. I have no idea, off the top of my head, of what might be happening.

**Comment by cooleynal** [comment]
Thanks for your help. I dont know enough to be able to identify the source of the problems myself.

I am not sure that i am having the server disconnect issue as a result of something new, such as being on ubuntu 20.10 vs windows or that I am running it long enough for it to disconnect unlike before.

**Comment by cooleynal** [comment]
Update: 

reinstalled roswell since it makes access to everything pretty easy.

My prompt in terminal was '*' now its '?'

**Comment by smashedtoatoms** [comment]
I don't like the way Roswell closes over my dev environment, so I've quit using it. Sorry that I am not very helpful in this regard.

**Comment by cooleynal** [comment]
I am not setup as a project.  Strictly a file.

Just the disconnect yielding: 
;; swank:close-connection: Unexpected end of file on #<STRING-INPUT-STREAM  :CLOSED #x302000EAD4FD>

occurs with both swank and slynk.

Is there an easy setup guide for sly?

**Comment by cooleynal** [comment]
> I don't like the way Roswell closes over my dev environment, so I've quit using it. Sorry that I am not very helpful in this regard.

What do you mean? 

I will get away from rosswell, lots going on behind the scenes I am not familiar with on it.

**Comment by smashedtoatoms** [comment]
> I am not setup as a project. Strictly a file.
> 
> Just the disconnect yielding:
> ;; swank:close-connection: Unexpected end of file on #<STRING-INPUT-STREAM :CLOSED #x302000EAD4FD>
> 
> occurs with both swank and slynk.
> 
> Is there an easy setup guide for sly?

You mean in emacs?

**Comment by cooleynal** [comment]
nope ur comment earlier speaking of sly.

**Comment by smashedtoatoms** [comment]
> > I don't like the way Roswell closes over my dev environment, so I've quit using it. Sorry that I am not very helpful in this regard.
> 
> What do you mean?
> 
> I will get away from rosswell, lots going on behind the scenes I am not familiar with on it.

I prefer composable tools. I prefer to be able to swap out tools as my needs change.   Roswell wraps my entire environment in a way that makes it inescapable. I have no way to configure exceptions that I might want. I have no access to the internals. Libraries and tools that use it are very hard to use if you don't also use Roswell. 

I might just not be familiar enough with it, but right now I am uncomfortable with the magic.

**Comment by smashedtoatoms** [comment]
> nope ur comment earlier speaking of sly.

I haven't used sly outside of emacs. I'll leave my code instance open for a bit and see if mine times out.

**Comment by cooleynal** [comment]
Ah got yah. Im the same way if I know what i am doing.

I am trying the same thing letting it idle on swank.

 I had two running windows running with VSC and i am wondering if that made a hickup down somewhere.

First exercise question today was to make a random number generator, in java we just used tools. I can see this course is gonna be closer to the metal than my past experiences. 

Already its lasted longer without timing out.

**Comment by nobody-famous** [comment]
I cloned sly from github, ran the slynk server from there, and it just doesn't work at all. They renamed a bunch of the APIs, so it errors on almost everything. I tried connecting to the slynk server with slime from emacs and it refuses to connect to it. I should probably do the same for now.

I have not seen it timeout, though, so it might be a parser issue.

**Comment by cooleynal** [comment]
ouch. that sucks.

So far stable with one window open. I got multiple screens i like to utilise.

**Comment by cooleynal** [comment]
I am running it in an external terminal window. Still closed its self. 

Grasping at straws, what OS are you guys on?

**Comment by nobody-famous** [comment]
I usually use the abort restart when the debugger comes up.

I bounce back and forth between Linux and windows. Which one are you using?

**Comment by cooleynal** [comment]
Ubuntu 20.10. 

Waiting for a new network adapter in the mail and will probably switch to Manjaro.

**Comment by cooleynal** [comment]
So far stable on resetting thread, and running one VSC instance and using an external terminal window to run the server

**Comment by nobody-famous** [comment]
Can you run this is a separate terminal?

sudo tcpdump -A -i lo port 4005

When it closes the connection, see what the last thing it shows is? It should show what's being sent between the extension and swank.

**Comment by cooleynal** [comment]
Strictly when I loaded the file Ctr shift enter.

tcpdump: verbose output suppressed, use -v or -vv for full protocol decode
listening on lo, link-type EN10MB (Ethernet), capture size 262144 bytes
16:32:04.437473 IP localhost.46928 > localhost.4005: Flags [P.], seq 3495853954:3495854043, ack 1623056489, win 512, options [nop,nop,TS val 369985389 ecr 369944500], length 89
E.....@.@............P...^..`..i...........
...m....000053(:emacs-rex (swank:load-file "/home/tr/COMP-456/Experimental/rng.lisp") nil t 2459)
16:32:04.441150 IP localhost.4005 > localhost.46928: Flags [P.], seq 1:75, ack 89, win 663, options [nop,nop,TS val 369985393 ecr 369985389], length 74
E..~.x@.@.@............P`..i.^.......r.....
...q...m000044(:return (:ok "#P\"/home/tr/COMP-456/Experimental/rng.lisp\"") 2459)
16:32:04.441162 IP localhost.46928 > localhost.4005: Flags [.], ack 75, win 512, options [nop,nop,TS val 369985393 ecr 369985393], length 0
E..4..@.@............P...^..`........(.....
...q...q
16:32:04.460266 IP localhost.46928 > localhost.4005: Flags [P.], seq 89:152, ack 75, win 512, options [nop,nop,TS val 369985412 ecr 369985393], length 63
E..s..@.@............P...^..`........g.....
.......q000039(:emacs-rex (swank:list-all-package-names t ) nil t 2460)
16:32:04.461032 IP localhost.4005 > localhost.46928: Flags [P.], seq 75:1709, ack 152, win 663, options [nop,nop,TS val 369985412 ecr 369985412], length 1634
E....y@.@.:............P`....^.............
........00065C(:return (:ok ("SWANK-IO-PACKAGE" "SWANK/GRAY" "CROSS-REFERENCE" "XREF" "SWANK/CCL" "SWANK-MONITOR" "SWANK" "SWANK-MOP" "SWANK/MATCH" "SWANK/RPC" "SWANK/BACKEND" "SWANK-BACKEND" "SWANK-LOADER" "ROSWELL.UTIL" "QL-SBCL" "QL-MKCL" "QL-ECL" "QL-LISPWORKS" "QL-SCL" "QL-CMUCL" "QL-CLISP" "QL-CLASP" "QL-CCL" "QL-ABCL" "QL-ALLEGRO" "QUICKLISP-CLIENT" "QUICKLISP" "QL" "QL-BUNDLE" "QL-DIST-USER" "QL-DIST" "QL-CDB" "QL-GUNZIPPER" "QL-MINITAR" "QL-HTTP" "QL-PROGRESS" "QL-NETWORK" "QL-IMPL-UTIL" "QL-IMPL" "QL-CONFIG" "QL-UTIL" "QL-INFO" "ASDF/FOOTER" "ASDF/USER" "ASDF-USER" "ASDF/INTERFACE" "ASDF-UTILITIES" "ASDF" "ASDF/BACKWARD-INTERFACE" "ASDF/BACKWARD-INTERNALS" "ASDF/SOURCE-REGISTRY" "ASDF/OUTPUT-TRANSLATIONS" "ASDF/PACKAGE-INFERRED-SYSTEM" "ASDF/CONCATENATE-SOURCE" "ASDF/BUNDLE" "ASDF/PARSE-DEFSYSTEM" "ASDF/DEFSYSTEM" "ASDF/FIND-SYSTEM" "ASDF/OPERATE" "ASDF/PLAN" "ASDF/FORCING" "ASDF/FIND-COMPONENT" "ASDF/LISP-ACTION" "ASDF/ACTION" "ASDF-ACTION" "ASDF/SYSTEM-REGISTRY" "ASDF/SYSTEM" "ASDF/OPERATION" "ASDF/COMPONENT" "ASDF/SESSION" "ASDF/UPGRADE" "UIOP/DRIVER" "ASDF/DRIVER" "UIOP" "UIOP/BACKWARD-DRIVER" "UIOP/CONFIGURATION" "UIOP/RUN-PROGRAM" "ASDF/RUN-PROGRAM" "UIOP/LAUNCH-PROGRAM" "UIOP/LISP-BUILD" "ASDF/LISP-BUILD" "UIOP/IMAGE" "UIOP/STREAM" "UIOP/FILESYSTEM" "UIOP/PATHNAME" "ASDF/PATHNAME" "UIOP/OS" "UIOP/VERSION" "UIOP/UTILITY" "UIOP/COMMON-LISP" "UOIP/CL" "UIOP/PACKAGE" "QL-SETUP" "ROSWELL" "ROS" "COMMON-LISP-USER" "CL-USER" "OPENMCL-SOCKET" "OPENMCL-MOP" "ANSI-LOOP" "|SwinkIO/0|" "SWINK" "INSPECTOR" "ARCH" "X86" "X8632" "GRAY" "COMMON-LISP" "CL" "CCL" "KEYWORD" "X8664" "TARGET" "X86-LINUX64" "OS")) 2460)
16:32:04.461052 IP localhost.46928 > localhost.4005: Flags [.], ack 1709, win 512, options [nop,nop,TS val 369985412 ecr 369985412], length 0
E..4..@.@............P...^..`........(.....
........

**Comment by cooleynal** [comment]
its maintained a stable connection for awhile. I dont know what changed other than applying the placebo of trying random things.

**Comment by cooleynal** [comment]
I think you want this. 

16:35:40.451884 IP localhost.46928 > localhost.4005: Flags [.], ack 2085, win 510, options [nop,nop,TS val 370201403 ecr 370201403], length 0
E..4..@.@............P...^.a`........(.....
...;...;

**Comment by cooleynal** [comment]
Function:
 Arglist: (VAR &OPTIONAL (VALUE NIL VALUE-P) DOC)

 Define a global variable at top level. Declare the variable
  SPECIAL and, optionally, initialize it. If the variable already has a
  value, the old value is not clobbered. The third argument is an optional
  documentation string for the variable.") 2461)
16:35:40.451884 IP localhost.46928 > localhost.4005: Flags [.], ack 2085, win 510, options [nop,nop,TS val 370201403 ecr 370201403], length 0
E..4..@.@............P...^.a`........(.....
...;...;
16:36:26.232766 IP localhost.46928 > localhost.4005: Flags [P.], seq 223:292, ack 2085, win 512, options [nop,nop,TS val 370247184 ecr 370201403], length 69
E..y..@.@............P...^.a`........m.....
.......;00003f(:emacs-rex (swank:documentation-symbol "SEED") CL-USER t 2462)
16:36:26.233333 IP localhost.4005 > localhost.46928: Flags [P.], seq 2085:2165, ack 292, win 663, options [nop,nop,TS val 370247185 ecr 370247184], length 80
E....{@.@.@............P`....^.......x.....
........00004A(:return (:ok "Documentation for the symbol SEED:

Not documented.") 2462)
16:36:26.233341 IP localhost.46928 > localhost.4005: Flags [.], ack 2165, win 512, options [nop,nop,TS val 370247185 ecr 370247185], length 0
E..4..@.@............P...^..`........(.....
........
16:36:26.838668 IP localhost.46928 > localhost.4005: Flags [P.], seq 292:360, ack 2165, win 512, options [nop,nop,TS val 370247790 ecr 370247185], length 68
E..x..@.@............P...^..`........l.....
...n....00003e(:emacs-rex (swank:documentation-symbol "INC") CL-USER t 2463)
16:36:26.839301 IP localhost.4005 > localhost.46928: Flags [P.], seq 2165:2244, ack 360, win 663, options [nop,nop,TS val 370247791 ecr 370247790], length 79
E....|@.@.@............P`....^.......w.....
...o...n000049(:return (:ok "Documentation for the symbol INC:

Not documented.") 2463)
16:36:26.839310 IP localhost.46928 > localhost.4005: Flags [.], ack 2244, win 512, options [nop,nop,TS val 370247791 ecr 370247791], length 0
E..4..@.@............P...^..`..,.....(.....
...o...o
16:36:28.311881 IP localhost.46928 > localhost.4005: Flags [P.], seq 360:427, ack 2244, win 512, options [nop,nop,TS val 370249263 ecr 370247791], length 67
E..w..@.@............P...^..`..,.....k.....
.../...o00003d(:emacs-rex (swank:documentation-symbol "N2") CL-USER t 2464)
16:36:28.312781 IP localhost.4005 > localhost.46928: Flags [P.], seq 2244:2322, ack 427, win 663, options [nop,nop,TS val 370249264 ecr 370249263], length 78
E....}@.@.@............P`..,.^.-.....v.....
...0.../000048(:return (:ok "Documentation for the symbol N2:

Not documented.") 2464)
16:36:28.312800 IP localhost.46928 > localhost.4005: Flags [.], ack 2322, win 512, options [nop,nop,TS val 370249264 ecr 370249264], length 0
E..4..@.@............P...^.-`..z.....(.....
...0...0

**Comment by cooleynal** [comment]
last two and this were idle. 


Not documented.") 2468)
16:37:39.132364 IP localhost.46928 > localhost.4005: Flags [.], ack 2644, win 512, options [nop,nop,TS val 370320084 ecr 370320084], length 0
E..4..@.@............P...^.C`........(.....
........
16:37:49.894337 IP localhost.46928 > localhost.4005: Flags [P.], seq 705:855, ack 2644, win 512, options [nop,nop,TS val 370330846 ecr 370320084], length 150
E.....@.@..I.........P...^.C`..............
........000090(:emacs-rex (swank:documentation-symbol "#'(lambda ()
    (ash (setf seed (mod (+ (* 214013 seed) 2531011) (expt 2 31))) -16))") CL-USER t 2469)
16:37:49.895087 IP localhost.4005 > localhost.46928: Flags [P.], seq 2644:2775, ack 855, win 671, options [nop,nop,TS val 370330846 ecr 370330846], length 131
E.....@.@.@............P`....^.............
........00007D(:return (:ok "No such symbol, #'(lambda ()
    (ash (setf seed (mod (+ (* 214013 seed) 2531011) (expt 2 31))) -16)).") 2469)
16:37:49.895096 IP localhost.46928 > localhost.4005: Flags [.], ack 2775, win 511, options [nop,nop,TS val 370330846 ecr 370330846], length 0
E..4..@.@............P...^..`..?.....(.....
........

**Comment by nobody-famous** [comment]
I'm trying to see what command it's sending that swank is giving an EOF error on. It'll be one of the (:emacs-rex ...) lines. Is swank still giving this error?

;; swank:close-connection: Unexpected end of file on #<STRING-INPUT-STREAM :CLOSED #x302000EAD4FD>

**Comment by nobody-famous** [comment]
Well, not one of. It should be the last emacs-rex before the connection is closed.

**Comment by cooleynal** [comment]
not for the past 30 minutes. I have not had to restart and reconnect Alive.

When I can keep it running and when it happens again send you that dump.

**Comment by nobody-famous** [comment]
Ok, sounds good.

My current theory is that there was something in your code that the parser was screwing up on and it was sending invalid code to swank for evaluation. I probably need better defensive coding around what I send to it.

**Comment by cooleynal** [comment]
This is outside the scope of your projecture Alive,

(defvar inc 0)

(defun avg (n1 n2 n3)
    (= inc 2)
    (/ (+ n1 n2 n3) 3)
    )

reutrns the average but when I have 

(defun avg (n1 n2 n3)
    (/ (+ n1 n2 n3) 3)
    (= inc 2)
    )

returns the comparison. 

So ( ... ) pars of equal depth, is the last one returned in a function?

**Comment by cooleynal** [comment]
> Ok, sounds good.
> 
> My current theory is that there was something in your code that the parser was screwing up on and it was sending invalid code to swank for evaluation. I probably need better defensive coding around what I send to it.

Your theory is probably very right.

**Comment by nobody-famous** [comment]
Lisp uses implicit returns, so the last thing evaluated in a body is the return value. That's true for loops, if statements, functions, everything.

If you have a function

(defun foo (x y)
  x
  y)

It'll return y because that's the last thing in the body.

(if t
    (progn  1 2 3)
    5)

Returns 3. T is true, so the first form is evaluated. The last thing evaluated in the progn body is the number 3, so that's returned.

You can kind of get around that by using the prog1 and prog2 macros. They return the first or second thing evaluated instead of the last. So,

(defun foo (x y)
  (prog1 x y))

Returns x and

(defun foo (x y)
  (prog2 x y 4  5 6))

Returns y. There's also (return ...) and (return-from ...) that can be used for early returns.

**Comment by cooleynal** [comment]
Saw it in my book and wanted to try it. 

When I input  the REPL: (append ‘(1 2) ‘(3 4)) 

Instant crash yielding output:

.1...0..000055(:emacs-rex (swank:interactive-eval "(append ...(1 2) ...(3 4))") COMMON-LISP-USER t 977)
17:10:49.980255 IP localhost.4005 > localhost.48452: Flags [F.], seq 209187, ack 74630, win 512, options [nop,nop,TS val 372310932 ecr 372310929], length 0
E..4..@.@..,...........D9H-.b..y.....(.....
.1...1..
17:10:49.980330 IP localhost.48452 > localhost.4005: Flags [F.], seq 74630, ack 209188, win 512, options [nop,nop,TS val 372310932 ecr 372310932], length 0
E..42N@.@.
t.........D..b..y9H-......(.....
.1...1..
17:10:49.980343 IP localhost.4005 > localhost.48452: Flags [.], ack 74631, win 512, options [nop,nop,TS val 372310932 ecr 372310932], length 0
E..4..@.@..+...........D9H-.b..z.....(.....
.1...1..

**Comment by nobody-famous** [comment]
Did you copy it from the book? It looks like it might be using a unicode character for the apostrophe.

**Comment by cooleynal** [comment]
> (defun foo (x y)
> (prog1 x y))
> 
> Returns x and
> 
> (defun foo (x y)
> (prog2 x y 4 5 6))

cool. thanks. I needed that.  that helps a lot.

hahaa yup i coped it from the book. I would have never guessed that. You saved me a few hours of questioning reality.

The book is normally copy protected, using a text reader in here made it copyable. 

I think i am on starting to get on my feet now in lisp.

**Comment by cooleynal** [comment]
If you want me to stop spamming your page about my issues, feel free to let me know.

How does one pass a list of an arbitrary length to a function?

One of many attempts.

in file:
(defun list-eater (list ll) )

in REPL:
(list-eater (1 2 3) ) 

Also how do i pass letters to a function, when i tread things like numbers i am told that they are undefined. 

Thanks.

**Comment by cooleynal** [comment]
oh dear, i think i solved my problem with '

**Comment by nobody-famous** [comment]
That's one way. Just remember that if the list you pass in has variables, the quote won't work right. To pass the variable values you'd need to use (list x y) instead of '(x y).

The other way is with a &rest parameter. That'll turn the arguments into a list for you.

(defun foo (&rest r) (format nil "~A" r))
(let ((x 5) (y 10)) (foo x y))

=> "(5 10)"

**Comment by cooleynal** [comment]
Okay Ill wrestle with trying that out tomorrow. 

last one for tonight.

REPL:
(wtf 5 '(5 1 2) )

(defun wtf (ele lis) 
    (if (= ele (nth 0 lis))
        (write 'FOUND-IT)
        (write '2222222222))
        (write 'DIDNT-FIND-IT)
        )

Always evaluates to false and outputs didnt find it. 

But when I type everything in REPL with a different name, it can evaluate to true.

Thoughts?

**Comment by nobody-famous** [comment]
It'll always print didnt-find-it because that's after the if statement. If you want either part of the if to have multiple steps, they need to be wrapped in a progn.

(if (= ele (nth 0 lis))
  (write 'FOUND-IT)
  (progn
    (write 'DIDNT-FIND-IT)
    (write '2222222222))
)

The fact that typing everything with a different name works suggests the function isn't getting re-evaluated and it's running an old copy.

**Comment by cooleynal** [comment]
*facepalm* 

So when i got use to firing up the servers through the terminal, and i have been been not paying attention to that output. Yesterday in our troubleshooting, i moved to the terminal window but neglected to read its output.

Many times functions are returning null in REPL when in terminal they are achieving the intended results.
gosh iam new. 

Quicklisp or clisp is suggested for the course, In the spirit of structuring code for a marker, would  someone would normally be looking at the terminal window correct? I want to be sure things are output the same way as someone would read it and I'am confident our setup is more advanced than the one used by the course evaluators.

**Comment by smashedtoatoms** [comment]
I've done this before.  Don't feel bad.  When you're in the repl, the functions will return the last statement evaluated in the function, and that is what you'll see in the repl.  If you use the format function though, it writes to stdout (terminal) as a side-effect, and the function returns NIL (that behavior can be modified).  If you're writing an application that someone is using, you'll likely want to output to stdout with a format command because they won't be using the repl.  Does that answer your question?

**Comment by cooleynal** [comment]
Absolutely. Thanks.

**Comment by nobody-famous** [comment]
Only other thing I'd add is that stdin is also still attached to the terminal, so if your program tries to read from the keyboard it'll need to be through the terminal as well.

**Comment by cooleynal** [comment]
Thanks Ill remember this.

Noone posts on the course forums and sometimes I need a little bump to see what my roadblock is. 

I appreciate having someone to talk to. Feeling quite claustrophobic as i am not confident in expressing things in lisp yet.  I am very excited to see this homoiconicity when it comes up, but first babysteps.

**Comment by cooleynal** [comment]
What is the safe and generally accepted to recurse through a list?

My intuition says at the start of a function to check if car of the list is nil.

End state is to reverse a list, then deal with a list that isnt flattened. 

(defun lr (lis)
    (write (car lis))
    (lr (cdr lis))
)

This blows up, as expected.

**Comment by nobody-famous** [comment]
You're on the right track. In general, recursive functions need to begin with a check that stops the recursion.

**Comment by cooleynal** [comment]
yup we got it. 

Thanks.  Figured out more of my issues, I was bias to adding more () pairs than needed, which you have alluded to.

**Comment by cooleynal** [comment]
(defun flip (lst)
    (cond
        ((null lst)
            nil
        )
        ((atom lst)
            (list lst)
        )
        (t
            (append (flip(cdr lst)) (flip(car lst)))
        )
    )
)

BIG BRAIN TIME!

**Comment by cooleynal** [comment]
Swank server is dropping again. Fresh run, no bugs in code (i hardly have anything coded). Only difference today is i am on bluetooth since our internet is down.

The last line entered is where the server dropped.

11:48:59.987600 IP localhost.39932 > localhost.4005: Flags [P.], seq 81925:81993, ack 228031, win 512, options [nop,nop,TS val 3628642995 ecr 3628625355], length 68
E..x..@.@.N.............@...5."U.....l.....
.H...Hm.00003e(:emacs-rex (swank:documentation-symbol "INC") CL-USER t 1060)
11:48:59.988432 IP localhost.4005 > localhost.39932: Flags [P.], seq 228031:228110, ack 81993, win 512, options [nop,nop,TS val 3628642996 ecr 3628642995], length 79
E.....@.@.<.............5."U@..r.....w.....
.H...H..000049(:return (:ok "Documentation for the symbol INC:

Not documented.") 1060)
11:48:59.988441 IP localhost.39932 > localhost.4005: Flags [.], ack 228110, win 512, options [nop,nop,TS val 3628642996 ecr 3628642996], length 0
E..4..@.@.N.............@..r5."......(.....
.H...H..
11:49:00.450954 IP localhost.39932 > localhost.4005: Flags [P.], seq 81993:82060, ack 228110, win 512, options [nop,nop,TS val 3628643459 ecr 3628642996], length 67
E..w..@.@.N.............@..r5."......k.....
.H...H..00003d(:emacs-rex (swank:documentation-symbol "20") CL-USER t 1061)
11:49:00.451843 IP localhost.4005 > localhost.39932: Flags [P.], seq 228110:228158, ack 82060, win 512, options [nop,nop,TS val 3628643459 ecr 3628643459], length 48
E..d..@.@.<.............5.".@........X.....
.H...H..00002A(:return (:ok "No such symbol, 20.") 1061)
11:49:00.451853 IP localhost.39932 > localhost.4005: Flags [.], ack 228158, win 512, options [nop,nop,TS val 3628643459 ecr 3628643459], length 0
E..4..@.@.N.............@...5."......(.....
.H...H..
11:49:00.849486 IP localhost.39932 > localhost.4005: Flags [P.], seq 82060:82127, ack 228158, win 512, options [nop,nop,TS val 3628643857 ecr 3628643459], length 67
E..w..@.@.N.............@...5."......k.....
.H...H..00003d(:emacs-rex (swank:documentation-symbol "20") CL-USER t 1062)
11:49:00.850512 IP localhost.4005 > localhost.39932: Flags [P.], seq 228158:228206, ack 82127, win 512, options [nop,nop,TS val 3628643858 ecr 3628643857], length 48
E..d..@.@.<.............5.".@........X.....
.H...H..00002A(:return (:ok "No such symbol, 20.") 1062)
11:49:00.850526 IP localhost.39932 > localhost.4005: Flags [.], ack 228206, win 512, options [nop,nop,TS val 3628643858 ecr 3628643858], length 0
E..4..@.@.N.............@...5.#......(.....
.H...H..
11:49:16.023831 IP localhost.39932 > localhost.4005: Flags [P.], seq 82127:82386, ack 228206, win 512, options [nop,nop,TS val 3628659031 ecr 3628643858], length 259
E..7..@.@.M.............@...5.#......+.....
.H.W.H..0000f9(:emacs-rex (swank:documentation-symbol "|
Xn+1 = (aXn + c) mod m
where X is the sequence of pseudo-random values
m, 0 < m  - modulus 
a, 0 < a < m  - multiplier
c, 0 ... c < m  - increment
x0, 0 ... x0 < m  - the seed or start value
|") CL-USER t 1063)
11:49:16.029548 IP localhost.4005 > localhost.39932: Flags [F.], seq 228206, ack 82386, win 520, options [nop,nop,TS val 3628659037 ecr 3628659031], length 0
E..4..@.@.=.............5.#.@........(.....
.H.].H.W
11:49:16.030108 IP localhost.39932 > localhost.4005: Flags [F.], seq 82386, ack 228207, win 512, options [nop,nop,TS val 3628659038 ecr 3628659037], length 0
E..4..@.@.N.............@...5.#......(.....
.H.^.H.]
11:49:16.030124 IP localhost.4005 > localhost.39932: Flags [.], ack 82387, win 520, options [nop,nop,TS val 3628659038 ecr 3628659038], length 0
E..4..@.@.=.............5.#.@........(.....
.H.^.H.^

**Comment by cooleynal** [comment]
Hasnt tripped yet, I thought that an unused variable was innocuous. 

After filling in the blanks it seems stable.

**Comment by nobody-famous** [comment]
Ah, yep, parser screwed up. It shouldn't allow new lines in symbol names like that.

Was the block with
    |
    Xn+1 = (aXn + c) mod m
    ...
    |

meant to be a comment, #|...|# and the pounds were left off, |...|?

**Comment by cooleynal** [comment]
Wow after you mention that i see it clearly. 

Sorry, so how do i comment? 

I do #|| .. lines ||#

**Comment by nobody-famous** [comment]
Block comments are everything between #| and |#. Single line comments are everything after a semicolon.

Without the pounds, it defines a variable name. If you want a variable with special characters, you enclose it in bars.

(defvar |that's all folks| t)
(when |that's all folks| ...)

**Comment by nobody-famous** [comment]
Oh, interesting. Yeah, #|| ... ||# should still be treated as a comment. I'll look into it after work. Something is broke with my parser.

**Comment by cooleynal** [comment]
Cool beans. Thanks a lot.
Ill use #| |#

That was another source of my glitches for sure.

**Comment by cooleynal** [comment]
Generic lisp question. 

(cons 1 2) vs (append (1) (2).

One is (1 2) another is (1 . 2). 

Is there any difference in them as both as objects? Say giving them a name, mechanically do they behave the same? 

I am reading the wiki on them.

**Comment by nobody-famous** [comment]
It has to do with how Lisp works under the covers. It's based on linked lists, where each node is called a cons cell. Each cell has a value and next, which for historical reasons are called car and cdr. The next part could be a value instead of a pointer. If they're both values, it's called a dotted pair, which is the (1 . 2) notation. What is referred to as a list is a sequence of cons cells, each pointing to the next and the last one pointing to nil.

So (1 2 3) is really (1 . (2 . (3 . nil))). It's easier to write the first way so that's what people use.

A lot of Lisp functions are different ways of manipulating cons cells and using them for different things. plists and alists, for example, are using linked lists as kind of hash maps.

To the original question, the main difference between cons and append is that cons adds to the head of a list, so is O(1), whereas append has to walk the list to find the end which makes it O(n).

**Comment by cooleynal** [comment]
I follow. ll pen out some con trees to get use to it. Probably explore (if its feasible) making one self balancing so cons and append both tend to O(lg(n)) time.

The terminal is giving the following warnings when compiling the function below: 
In TESTZ: Undeclared free variable TEMP (3 references). 
Am i doing something less than ideal? What would you do different? 

The intent of the following lines is to use "let" , and demonstrate a variable with a wider scope with a very narrow scope. 

(defun testz ()
    (setq temp 555)
    (format t "the value y is ~D, ~%" temp)
    (let 
        ((temp 222) (y 'b)(z 'c))
        (format t "x = ~a y = ~a z = ~a ~%" temp y z)
    )
    (format t "the value y is ~D, ~% ~%" temp)
)

**Comment by cooleynal** [comment]
Okay.

I had some hickups today with the server closing its self, it was only when i was working inside the multiline quotes.

I want to be symbolic. 

I can do this in prolog but in i am having troubles in lisp.

All men are mortal -> therefore socretes is a man.

man(socrates).
mortal(X) :- man(X).

In lisp, something like the following?

(defun man (in)
  (if (= in 'socrates) ;;give a true or false
)

(defun mortal (in)
  (man in)
)

Would something like that work?

And how would i query it for it to tell me that its socrates?

Thanks.

**Comment by nobody-famous** [comment]
I just noticed the updated question. Cond's syntax is a little weird, it takes a series of lists, where each list takes a condition expression and an expression to evaluate if the condition evaluates to true (anything other than nil is true). This is one case where you didn't have enough parens. :-) Also, it should be t, not true. True isn't defined.

`(cond ((= 1 1) (format nil "Yep"))
      (t (format nil "Nope")))`

**Comment by nobody-famous** [comment]
I'm going to go ahead and close this issue. I've put up a new version with fixes for the issues that have come up here.

- Fixed the parser bug
- Added alive.autoLoadOnSave option. When true, automatically loads files into the REPL when they're saved. This should help with the "forgot to reevaluate" errors.
- Attaching to the REPL prompts for host:port.
- Added alive.remoteWorkspace option to specify where to look for files relative to the REPL. This is needed for WSL to work.
- Rename function arguments and let bindings.
